nom,code,adresse,telephone,email,ville,pays
STAR Assurance,STAR,Avenue Habib Bourguiba Tunis,71234567,contact@star.tn,Tunis,Tunisie
COMAR Assurance,COMAR,Rue de la Liberté Tunis,71345678,info@comar.tn,Tunis,Tunisie
GAT Assurance,GAT,Avenue Mohamed V Sfax,74456789,contact@gat.tn,Sfax,Tunisie
Maghrebia Assurance,MAGHREBIA,Boulevard du 7 Novembre Sousse,73567890,info@maghrebia.tn,Sousse,Tunisie
Assurances Salim,SALIM,Rue Mongi Slim Bizerte,72678901,contact@salim.tn,Bizerte,Tunisie
Lloyd Tunisien,LLOYD,Avenue de la République Gabès,75789012,info@lloyd.tn,Gabès,Tunisie
Carte Assurance,CARTE,Rue Ibn Khaldoun Kairouan,77890123,contact@carte.tn,Kairouan,Tunisie
Zitouna Takaful,ZITOUNA,Avenue Bourguiba Monastir,73901234,info@zitouna.tn,Monastir,Tunisie
